{
  "$schema": "http://json-schema.org/draft-04/schema#",
  "type": "object",
  "properties": {
    "externalRef": {
      "type": "object",
      "properties": {
        "id": {
          "type": "string",
          "description": "A unique ID for this message generated by the calling service"
        },
        "source": {
          "type": "string",
          "description": "The source of this message i.e. mdtp"
        }
      },
      "required": [
        "id",
        "source"
      ]
    },
    "recipient": {
      "type": "object",
      "properties": {
        "regime": {
          "type": "string",
          "description": "Regime"
        },
        "taxIdentifier": {
          "type": "object",
          "properties": {
            "name": {
              "type": "string",
              "description": "The tax identifier name to which this message relates."
            },
            "value": {
              "type": "string",
              "description": "The recipient customer's tax identifier value."
            }
          },
          "required": [
            "name",
            "value"
          ]
        },
        "name": {
          "type": "object",
          "properties": {
            "line1": {
              "type": "string",
              "description": "The name of the recipient, for example “John Paul Smith” or “Mr. J Smith”."
            },
            "line2": {
              "type": "string",
              "description": "A second name line for the recipient."
            },
            "line3": {
              "type": "string",
              "description": "A third name line for the recipient."
            }
          }
        },
        "email": {
          "type": "string",
          "description": "If provided, the notification email for this message will be sent to this email address."
        }
      },
      "required": [
        "regime",
        "taxIdentifier"
      ]
    },
    "tags": {
      "type": "object",
      "properties": {
        "notificationType": {
          "type": "string",
          "description": "Notification type"
        }
      }
    },
    "messageType": {
      "type": "string",
      "description": "This is used to determine the email alert to use for this message."
    },
    "language": {
      "type": "string",
      "description": "This is optional, will be used to determine the language sets for email subjaect"
    },
    "validFrom": {
      "type": "string",
      "format": "date",
      "description": "The date on which this message becomes valid."
    },
    "content": {
      "type": "array",
      "items": [
        {
          "type": "object",
          "properties": {
            "lang": {
              "type": "string",
              "minLength": 1,
              "pattern": "^\\S.*$",
              "description": "Content language i.e. 'en' or 'cy'"
            },
            "subject": {
              "type": "string",
              "minLength": 1,
              "pattern": "^\\S.*$",
              "description": "Subject line"
            },
            "body": {
              "type": "string",
              "minLength": 1,
              "pattern": "^\\S.*$",
              "description": "<base64 encoded source data>"
            }
          },
          "required": [
            "lang",
            "subject",
            "body"
          ]
        }
      ]
    },
    "alertDetails": {
      "type": "object",
      "properties": {
        "data": {
          "type": "object",
          "properties": {
            "key1": {
              "type": "string",
              "description": "Key 1"
            },
            "key2": {
              "type": "string",
              "description": "Key 2"
            }
          },
          "required": [
            "key1",
            "key2"
          ]
        }
      },
      "required": [
        "data"
      ]
    },
    "alertQueue": {
      "type": "string",
      "description": "The email messaging queue to place the email alert for this message onto."
    },
    "details": {
      "type": "object",
      "properties": {
        "formId": {
          "type": "string",
          "description": "The form ID of the message that we are sending."
        },
        "issueDate": {
          "type": "string",
          "format": "date",
          "description": "The date this message was created by the source system."
        },
        "batchId": {
          "type": "string",
          "description": "If this message is part of a 'batch' or 'print' run that has an ID, then specify this here."
        },
        "sourceData": {
          "type": "string",
          "description": "This is the source data that GMC received in the HODS file for this message."
        },
        "properties": {
          "type": "array",
          "items": [
            {
              "type": "object",
              "properties": {
                "property": {
                  "type": "object",
                  "properties": {
                    "name": {
                      "type": "string",
                      "minLength": 1,
                      "pattern": "^\\S.*$"
                    },
                    "value": {
                      "type": "string",
                      "minLength": 1,
                      "pattern": "^\\S.*$"
                    }
                  },
                  "required": [
                    "name",
                    "value"
                  ]
                }
              },
              "required": [
                "property"
              ]
            }
          ]
        }
      },
      "required": [
        "formId"
      ]
    }
  },
  "required": [
    "externalRef",
    "recipient",
    "messageType",
    "content"
  ]
}