{
  "externalRef": {
    "id": "ANJ241434432110001",
    "source": "mdtp"
  },
  "recipient": {
    "regime": "sdil",
    "taxIdentifier": {
      "name": "HMRC-OBTDS-ORG",
      "value": "XVSDIL000100389"
    },
    "name": {
      "line1": "Anjali",
      "line2": "Padmanabhan",
      "line3": "Nair"
    },
    "email":"anjali.nair@digital.hmrc.gov.uk"
  },
  "content": [
    {
      "lang": "en",
      "subject": "Send your quarterly Income Tax update",
      "body": "PGRpdiBjbGFzcz0iZ292dWstZ3JpZC1yb3cgZ3JpZC1yb3ciPg0KPGRpdiBjbGFzcz0iZ292dWstZ3JpZC1jb2x1bW4tdHdvLXRoaXJkcyBjb2x1bW4tdHdvLXRoaXJkcyI+DQo8c2VjdGlvbiBsYW5nPSJlbiI+DQo8cCBjbGFzcz0iZ292dWstYm9keSI+WW91IG11c3Qgc2VuZCB1cyB5b3VyIGluY29tZSBhbmQgZXhwZW5zZXMgdXBkYXRlIGZvciB5b3VyIGZvcmVpZ24gcHJvcGVydHkgaW5jb21lIGZvciB0aGUgcXVhcnRlciBlbmRpbmcgMDUgSnVseSAyMDIwLjwvcD4NCjxwIGNsYXNzPSJnb3Z1ay1ib2R5Ij5Zb3UgbmVlZCB0byBzZW5kIHRoZSB1cGRhdGVzIHRvIHVzIG9uIG9yIGJlZm9yZSAwNSBBdWd1c3QgMjAyMC48L3A+DQo8cCBjbGFzcz0iZ292dWstYm9keSI+V2UgbWF5IGF3YXJkIHlvdSBhIHBlbmFsdHkgaWYgeW91ciBxdWFydGVybHkgdXBkYXRlcyBhcmUgbGF0ZS48L3A+DQo8cCBjbGFzcz0iZ292dWstYm9keSI+SXQgaXMgeW91ciByZXNwb25zaWJpbGl0eSB0byBtYWtlIHN1cmUgeW91IHNlbmQgdXMgYWxsIG5lY2Vzc2FyeSBzdWJtaXNzaW9ucy4gSWYgeW91IGhhdmUgYW4gYWdlbnQsIHlvdSBtYXkgd2FudCB0byBkaXNjdXNzIHRoaXMgcmVtaW5kZXIgd2l0aCB0aGVtLjwvcD4NCjxwIGNsYXNzPSJtZXNzYWdlX3RpbWUgZmFkZWQtdGV4dC0tc21hbGwgZ292dWstYm9keS1zIj5NZXNzYWdlIHJlZmVyZW5jZSYjNTg7IElUU0FRVTEgMDUvMjIgMS4wPC9wPg0KPC9zZWN0aW9uPg0KPC9kaXY+DQo8L2Rpdj4="
    },
    {
      "lang": "cy",
      "subject": "Anfonwch eich diweddariad Treth Incwm chwarterol",
      "body": "PGRpdiBjbGFzcz0iZ292dWstZ3JpZC1yb3cgZ3JpZC1yb3ciPgo8ZGl2IGNsYXNzPSJnb3Z1ay1ncmlkLWNvbHVtbi10d28tdGhpcmRzIGNvbHVtbi10d28tdGhpcmRzIj4KPHNlY3Rpb24gbGFuZz0iY3kiPgo8cCBjbGFzcz0iZ292dWstYm9keSI+UmhhaWQgaSBjaGkgYW5mb24gZWljaCBkaXdlZGRhcmlhZCBpbmN3bSBhIHRocmV1bGlhdSBhciBneWZlciBlaWNoIGluY3dtIG8gZWlkZG8gdHJhbW9yIGFyIGd5ZmVyIHkgY2h3YXJ0ZXIgeW4gZGl3ZWRkdSAwNSBHb3JmZmVubmFmIDIwMjAgYXRvbS48L3A+CjxwIGNsYXNzPSJnb3Z1ay1ib2R5Ij5NYWUgYW5nZW4gaSBjaGkgYW5mb24geSBkaXdlZGRhcmlhZGF1IGF0b20gYXIgbmV1IGN5biAwNSBBd3N0IDIwMjAuPC9wPgo8cCBjbGFzcz0iZ292dWstYm9keSI+TWFl4oCZbiBib3NpYmwgeSBieWRkd24geW4gcmhvaSBjb3NiIGkgY2hpIG9zIGJ5ZGQgZWljaCBkaXdlZGRhcmlhZGF1IGNod2FydGVyb2wgeW4gaHd5ci48L3A+CjxwIGNsYXNzPSJnb3Z1ay1ib2R5Ij5FaWNoIGN5ZnJpZm9sZGViIGNoaSB5dyBzaWNyaGF1IGVpY2ggYm9kIHluIGFuZm9uIHlyIGhvbGwgZ3lmbHd5bmlhZGF1IGFuZ2VucmhlaWRpb2wgYXRvbS4gT3Mgb2VzIGdlbm55Y2ggYXNpYW50LCBlZmFsbGFpIHkgYnlkZHdjaCBhbSBkcmFmb2QgeSBub2R5biBhdGdvZmZhIGh3biBneWRhIG5ody48L3A+CjxwIGNsYXNzPSJtZXNzYWdlX3RpbWUgZmFkZWQtdGV4dC0tc21hbGwgZ292dWstYm9keS1zIj5DeWZlaXJub2QgeSBuZWdlcyYjNTg7IElUU0FRVTEgMDUvMjIgMS4wPC9wPgo8L3NlY3Rpb24+CjwvZGl2Pgo8L2Rpdj4="
    }
  ],
  "messageType": "newMessageAlert",
  "validFrom": "2023-03-13",
  "alertQueue": "DEFAULT"
}